{
  "version": "0.1",
  "title": "纳瓦尔宝典",
  "author": "纳瓦尔·拉维坎特（埃里克·乔根森 编）",
  "format": {
    "aspect_ratio": "9:16",
    "resolution": "1080x1920",
    "target_duration_seconds": 120,
    "fps": 30
  },
  "voice": {
    "language": "zh-CN",
    "style": "沉稳、自然、有思考感的知识类旁白，语速偏慢，留有呼吸感",
    "speed": 1.0
  },
  "music": {
    "enabled": true,
    "style": "极简氛围钢琴，安静克制，适合思考型内容",
    "volume_db": -24
  },
  "scenes": [
    {
      "id": "scene_001",
      "duration_seconds": 8,
      "narration": "为什么有人睡觉的时候，财富还在增长？《纳瓦尔宝典》给出的答案，可能和你的直觉相反。",
      "visual": {
        "type": "title_card",
        "prompt": "竖屏 9:16，深色静谧背景，一扇夜色中的窗户透出微光，窗外城市灯光模糊，背景中有一条抽象且缓慢上升的细线象征财富增长。极简高级感，冷蓝灰色调，中央留出标题区域，电影感光效，不生成额外可读文字。",
        "negative_prompt": "杂乱元素，明艳卡通风格，多余文字，水印，logo",
        "motion": "slow push-in"
      },
      "onscreen_text": "为什么财富在你睡觉时还在增长？",
      "transition": "cut"
    },
    {
      "id": "scene_002",
      "duration_seconds": 10,
      "narration": "这本书由埃里克·乔根森整理，收录了硅谷投资人纳瓦尔·拉维坎特十年的公开思考，只讲两件事：财富，和幸福。",
      "visual": {
        "type": "image",
        "prompt": "竖屏 9:16，一本关于财富与人生思考的书静置在木质书桌上，封面极简且不出现可读文字，旁边是一杯冒着热气的茶和一支钢笔。暖黄色台灯从侧面照亮桌面，浅景深，安静书房氛围，写实摄影风格，大面积干净留白。",
        "negative_prompt": "清晰书名文字，品牌标识，logo，杂乱桌面，可识别人物面孔",
        "motion": "slow pan right"
      },
      "onscreen_text": "十年公开思考，只讲两件事：财富与幸福",
      "transition": "fade"
    },
    {
      "id": "scene_003",
      "duration_seconds": 13,
      "narration": "第一个颠覆认知的区分是：金钱不等于财富。财富，是那些在你睡觉时仍然为你工作的资产；金钱，只是转移财富的社会工具。",
      "visual": {
        "type": "image",
        "prompt": "竖屏 9:16，概念性写实插画。左侧是一叠模糊、不带真实币种图案的纸张象征金钱，右侧是一棵在夜色中缓慢生长、枝叶散发微光的树，树根与远处城市建筑和数字网络连接，象征资产持续创造价值。深蓝夜色，极简对称构图。",
        "negative_prompt": "真实货币细节，钞票文字，卡通贴纸，复杂背景，logo",
        "motion": "slow zoom-in"
      },
      "onscreen_text": "金钱 ≠ 财富",
      "transition": "cut"
    },
    {
      "id": "scene_004",
      "duration_seconds": 10,
      "narration": "纳瓦尔直言，靠出租自己的时间，几乎不可能致富。时间是一条直线，收入的上限，从一开始就被锁死了。",
      "visual": {
        "type": "image",
        "prompt": "竖屏 9:16，极简概念画面。一条发光直线从画面底部延伸向远处，终点是一堵半透明墙，一个孤独人物剪影沿直线向前走。冷灰蓝色调，纯净渐变背景，空间感强，象征时间与收入存在固定上限。",
        "negative_prompt": "拥挤人群，复杂纹理，恐怖氛围，文字，logo",
        "motion": "slow pan forward"
      },
      "onscreen_text": "出租时间，上限被锁死",
      "transition": "cut"
    },
    {
      "id": "scene_005",
      "duration_seconds": 14,
      "narration": "真正的关键是杠杆。劳动和资本是传统的杠杆，需要跟随者和资金；而这个时代出现了新的杠杆——代码和媒体，复制成本几乎为零，也不需要任何人许可。",
      "visual": {
        "type": "image",
        "prompt": "竖屏 9:16，现代科技概念插画。画面中央是一根金属杠杆撬动巨大的发光方块，方块后方延展出抽象代码流、文章页面、视频窗口和数字节点，并向远处重复复制扩散。暗色背景，蓝紫科技色调，粒子微光，高级极简构图，不使用真实应用界面。",
        "negative_prompt": "真实品牌图标，真实社交媒体 logo，杂乱文字，界面截图",
        "motion": "slow zoom-out"
      },
      "onscreen_text": "新杠杆：代码 × 媒体",
      "transition": "zoom"
    },
    {
      "id": "scene_006",
      "duration_seconds": 14,
      "narration": "和杠杆配套的，是专长：那些培训班教不出来、只能从你自己的好奇心里长出来的能力。纳瓦尔的建议可以概括为：把自己产品化。",
      "visual": {
        "type": "image",
        "prompt": "竖屏 9:16，一本打开的书放在干净桌面上，一株植物从书页中央生长出来，逐渐形成形状独特的小树。树冠融入抽象的代码、写作、声音和创造力符号，但图形保持简洁克制。暖金与青绿色调，大面积留白，现代编辑插画风格。",
        "negative_prompt": "密集图标，复杂文字，写实人脸，卡通儿童风",
        "motion": "slow push-in"
      },
      "onscreen_text": "专长：从好奇心里长出来 / 把自己产品化",
      "transition": "dissolve"
    },
    {
      "id": "scene_007",
      "duration_seconds": 11,
      "narration": "有意思的是，这本讲赚钱的书，后半部分几乎都在讲幸福。纳瓦尔认为，幸福不是奖励，而是一种可以练习的技能。",
      "visual": {
        "type": "image",
        "prompt": "竖屏 9:16，清晨山间薄雾，一个人物背影坐在木屋阳台上安静地喝咖啡，看向远处层叠山峦。柔和晨光，低饱和暖色，开阔留白，宁静治愈，写实摄影质感，人物不是画面主体。",
        "negative_prompt": "正脸特写，喧闹场景，高饱和色彩，文字，logo",
        "motion": "slow pan down"
      },
      "onscreen_text": "幸福是一种可以练习的技能",
      "transition": "fade"
    },
    {
      "id": "scene_008",
      "duration_seconds": 12,
      "narration": "他对欲望有一个冷静的观察：痛苦往往不是因为拥有得太少，而是同时想要得太多。欲望，是你和幸福之间签下的契约。",
      "visual": {
        "type": "image",
        "prompt": "竖屏 9:16，极简禅意概念画面。平静湖面中央，一个人物剪影站在小船上，周围漂浮多个柔和发光球体，每个球体通过极细的线条向人物延伸，象征不同欲望同时拉扯注意力。深蓝夜色，中心构图，湖面平静，空间干净。",
        "negative_prompt": "风暴，巨浪，惊悚氛围，密集元素，文字，logo",
        "motion": "slow zoom-in"
      },
      "onscreen_text": "欲望：你和幸福之间的契约",
      "transition": "dissolve"
    },
    {
      "id": "scene_009",
      "duration_seconds": 11,
      "narration": "所以他给出的日常建议朴素得惊人：大量阅读，精选值得读的书；减少欲望，把注意力放回当下。",
      "visual": {
        "type": "image",
        "prompt": "竖屏 9:16，俯拍极简书桌。一双手捧着一本翻开的书，桌面只保留书、一盏台灯和一支笔。画面上半部分有大面积留白用于字幕。暖色灯光，柔和阴影，安静克制，写实摄影，浅景深。",
        "negative_prompt": "手机，电脑，杂乱桌面，大量书堆，清晰文字，logo",
        "motion": "slow zoom-in"
      },
      "onscreen_text": "多读书 · 少欲望 · 回到当下",
      "transition": "cut"
    },
    {
      "id": "scene_010",
      "duration_seconds": 10,
      "narration": "如果只带走一个观点，也许是：别再问怎么更努力，先问你的努力，有没有用上杠杆。这就是《纳瓦尔宝典》。",
      "visual": {
        "type": "title_card",
        "prompt": "竖屏 9:16，深色极简结尾背景。中央留出书名与核心观点的排版区域，背景只有少量缓慢向上延伸的金色细线和微弱光点，象征复利与长期增长。蓝黑与暖金配色，高级编辑设计感，不生成任何额外可读文字。",
        "negative_prompt": "复杂插画，密集文字，水印，logo，强烈闪光",
        "motion": "slow fade-in"
      },
      "onscreen_text": "别问怎么更努力，先问有没有用上杠杆",
      "transition": "fade"
    }
  ]
}
